{
  "$schema": "https://json-schema.org/draft/2020-12/schema",
  "$id": "https://github.com/auction-promax/api/security/schemas/hosted-supply-chain-contract.schema.json",
  "type": "object",
  "additionalProperties": false,
  "required": ["schemaVersion", "workflowPaths", "actions", "runners", "timeouts", "jobs", "evidence"],
  "properties": {
    "schemaVersion": { "const": 1 },
    "workflowPaths": { "$ref": "#/$defs/workflowPaths" },
    "actions": { "$ref": "#/$defs/actions" },
    "runners": { "$ref": "#/$defs/runners" },
    "timeouts": { "$ref": "#/$defs/timeouts" },
    "jobs": { "$ref": "#/$defs/jobs" },
    "evidence": { "$ref": "#/$defs/evidence" }
  },
  "$defs": {
    "workflowPaths": { "type": "object", "additionalProperties": false, "required": ["baseline", "supplyChain", "freshness"], "properties": { "baseline": { "const": ".github/workflows/api-baseline.yml" }, "supplyChain": { "const": ".github/workflows/supply-chain.yml" }, "freshness": { "const": ".github/workflows/security-freshness.yml" } } },
    "actions": { "type": "object", "additionalProperties": false, "required": ["checkout", "setupJava", "setupNode", "uploadArtifact"], "properties": { "checkout": { "const": "11d5960a326750d5838078e36cf38b85af677262" }, "setupJava": { "const": "cf277c60eb25467037889841efdb72551f06f6c3" }, "setupNode": { "const": "49933ea5288caeca8642d1e84afbd3f7d6820020" }, "uploadArtifact": { "const": "ea165f8d65b6e75b540449e92b4886f43607fa02" } } },
    "runners": { "type": "object", "additionalProperties": false, "required": ["hostedLinux"], "properties": { "hostedLinux": { "const": "ubuntu-24.04" } } },
    "timeouts": { "type": "object", "additionalProperties": false, "required": ["verificationMinutes", "releasePolicyMinutes", "freshnessMinutes"], "properties": { "verificationMinutes": { "const": 60 }, "releasePolicyMinutes": { "const": 5 }, "freshnessMinutes": { "const": 60 } } },
    "jobs": { "type": "object", "additionalProperties": false, "required": ["verification", "releasePolicy", "freshness"], "properties": { "verification": { "const": "supply-chain-verification" }, "releasePolicy": { "const": "release-policy" }, "freshness": { "const": "security-freshness" } } },
    "evidence": { "type": "object", "additionalProperties": false, "required": ["relativePath", "retentionDays", "files"], "properties": { "relativePath": { "const": "s001-t07-evidence/hosted" }, "retentionDays": { "const": 30 }, "files": { "const": ["run-summary.json", "vulnerability-inventory.json", "gitleaks-inventory.json", "container-vulnerability-inventory.json", "image-identity.json", "smoke-summary.json", "policy-summary.json"] } } }
  }
}
